{

  "Key": "MoveEntityTest",
  "Author": "Mmaarten",
  "CreateEntity": {
    "key": "Agnes",
    "entity": "PLAYER",
    "skin": {
      "texture": "ewogICJ0aW1lc3RhbXAiIDogMTYyNDQ0NzUwNjI0NiwKICAicHJvZmlsZUlkIiA6ICJkMGFkNThjOTNiMzY0ZjgyOWRjZWEzMTAzMzE5MTgyMSIsCiAgInByb2ZpbGVOYW1lIiA6ICJfU2FwcGhpcmVfTHVuYV8iLAogICJzaWduYXR1cmVSZXF1aXJlZCIgOiB0cnVlLAogICJ0ZXh0dXJlcyIgOiB7CiAgICAiU0tJTiIgOiB7CiAgICAgICJ1cmwiIDogImh0dHA6Ly90ZXh0dXJlcy5taW5lY3JhZnQubmV0L3RleHR1cmUvZmFlYTU1YjRiODcwZjc5YjVhNmYzOWRkMjgzMmVkNDY1ZjdjYzMxZmE4MGMwNjIzMmMwNWFhMDBlMGQ3NzZmIiwKICAgICAgIm1ldGFkYXRhIiA6IHsKICAgICAgICAibW9kZWwiIDogInNsaW0iCiAgICAgIH0KICAgIH0KICB9Cn0=",
      "signature": "j9zav92rL72m954bvop7xBHUHKz/J6wEUNf1ohonapyoJb3vetBmoYW8UoOmMQCzYagf3z/PbfafecEIQ/cbQBtxZ7sDlQxfOqmhcIpOtBOj3qSHygs0TDa+YwHjybxCn00YT6eivyewi51O0+ZUDmmOD4V8YwD/RFmMDCd9TGtN9r1JYNmG7G4qpaOlcsnUzVbcxf3uT0vCssiEODByr06Kb8tiGSwH8MjvMjeWBOqzB9HuxWVoNV1NOtdvJEKWaOpeMl5tQUK6bSR6HsganSx6xNh+mG9SISL5wAUYdDFnHvgyBUwe6QHq3jFXBlHQs/0sf2PLfV1gLxvmSHUIx4RJR/qfI+VyVr/tW6m7ptehKRS40GacFN8t9V9CYkXFYM2+/Y6ab5owfUUpqicLvCqminwDyT7H9pfh+TO9/9gO06j0x0FNmHo8hdQf5YZrqTdQ1UZI908KpNTuii9vAtDKmANgeNYCMg9lcp00x5s+hv10FfIRVZeRCHvqsfb7BwIEu4l9CxEHqeZPDNm6yuTxlHLbOxnonn572YhcVDMHAZXzsmpG4styET14tdzkAVMF4c0P/FUm/qflVgpTFPMRIbZwXaho6tQpF6QCMoplB+kZvrZW5bcDUZIsq6m5HhY6Vp/eTqcOMhy+9B8eJI1WpyBWcCtEtHRGL157Vy8="
    },
    "location": [1901.5, 39.0, 529, -90],
    "name": [
      "&5&lAgnes"
    ],
    "hand": {
      "material": "written_book"
    },
    "look": true,
    "gravity": true
  },
  "MoveEntity": ["Agnes", 1905.5, 38.0, 529.0],
  "SendMessage": "1",
  "Wait": 2.0,
  "MoveEntity": ["Agnes", 1908.0, 38.0, 531.0],
  "SendMessage": "2",
  "Wait": 2.0,
  "MoveEntity": ["Agnes", 1911.0, 38.0, 528.0],
  "SendMessage": "3",
  "Wait": 2.0,
  "MoveEntity": ["Agnes", 1912.0, 37.0, 528.0, false],
  "SendMessage": "4",
  "Wait": 2.0,
  "MoveEntity": ["Agnes", 1922.0, 37.0, 528.0, false],
  "SendMessage": "5",
  "Wait": 2.0,
  "MoveEntity": ["Agnes", 1926.0, 33.0, 528.0, false],
  "SendMessage": "6"
}